graph_order,acronym,name_x,DHBA_name,DHBA_acronym,DHBA_id,color_hex_triplet,uDHBA_id,r,g,b,a,vis,msh
998,CLiR,caudal linear nucleus of the raphe,,,DHBA:AA30361,,1336,0,130,200,1,1,1
999,CLiAz,"caudal linear nucleus of the raphe, azygos part",,,DHBA:AA30362,,1337,245,130,48,1,1,1
1000,CLiZ,"caudal linear nucleus of the raphe, zygos part","caudal linear nucleus of the raphe, zygos part",CLinZ,DHBA:12233,#5298AE,1338,0,128,128,1,1,1
1001,MCc,central cell groups in midbrain,,,DHBA:AA30363,,1339,0,0,128,1,1,1
1002,RN,red nucleus,red nucleus,RN,DHBA:12247,#6CA9BF,359,30,207,255,1,1,1
1003,RNdm,"red nucleus, dorsomedial part","red nucleus, dorsomedial part",RNdm,DHBA:12248,#5298AE,1340,245,130,48,1,1,1
1004,RNmc,"red nucleus, magnocellular part","red nucleus, magnocellular part",RNmc,DHBA:12249,#4D8DA3,1341,0,0,128,1,1,1
1005,RNpc,"red nucleus, parvicellular part","red nucleus, parvicellular part",RNpc,DHBA:12250,#56A1BB,1342,255,215,180,1,1,1
1006,PRu,perirubral region of central cell groups,,,DHBA:AA30364,,1343,250,190,212,1,1,1
1007,PrR,prerubral regions,,,DHBA:AA30365,,1344,0,128,128,1,1,1
1008,RRF,retrorubral field,retrorubral field,RRF,DHBA:12289,#5298AE,1345,145,30,180,1,1,1
1009,RR,retrorubral nucleus,,,DHBA:AA30366,,1346,255,215,180,1,1,1
1010,DA8,A8 dopamine cell group,caudal portion of DFC (area 8),A8,DHBA:10174,#D4B235,1347,230,25,75,1,1,1
1011,PaR,pararubral nucleus,,,DHBA:AA30367,,1348,128,128,0,1,1,1
1012,MVC,ventral cell groups in midbrain,,,DHBA:AA30368,,1349,0,0,128,1,1,1
1013,SN,substantia nigra,substantia nigra,SN,DHBA:12251,#6CA9BF,360,62,29,203,1,1,1
1014,SNC,"substantia nigra, compact part","substantia nigra, compact part",SNC,DHBA:12252,#43808F,1350,230,25,75,1,1,1
1015,SNCd,"substantia nigra, compact part, dorsal subdivision","substantia nigra, compact part, dorsal subdivision",SNCd,DHBA:12253,#43808F,1351,60,180,75,1,1,1
1016,SNCm,"substantia nigra, compact part, medial subdivision","substantia nigra, compact part, medial subdivision",SNCm,DHBA:12254,#43808F,1352,128,128,0,1,1,1
1017,SNCv,"substantia nigra, compact part, ventral subdivision","substantia nigra, compact part, ventral subdivision",SNCv,DHBA:12255,#43808F,1353,145,30,180,1,1,1
1018,SNR,"substantia nigra, reticular part","substantia nigra, reticular part",SNR,DHBA:12259,#6CA9BF,1354,255,215,180,1,1,1
1019,SNL,"substantia nigra, lateral part","substantia nigra, lateral part",SNL,DHBA:12257,#478599,1355,128,128,128,1,1,1
1020,SNM,"substantia nigra, medial Part",,,DHBA:AA30369,,1356,240,50,230,1,1,1
1021,MTN,medial terminal nucleus of accessory nucleus of optic tract ,"accessory nuclei of optic tract, medial nucleus",AOPm,DHBA:12193,#6CA9BF,1357,255,225,25,1,1,1
1022,VTR,ventral tegmental region of midbrain,ventral tegmental region of midbrain,VTR,DHBA:146034938,#8EBDCD,361,0,114,37,1,1,1
1023,VTA,ventral tegmental area,ventral tegmental area,VTA,DHBA:12261,#7EB3C9,1358,230,25,75,1,1,1
1024,IF,interfascicular nucleus,interfascicular nucleus,IF,DHBA:12262,#56A1BB,1359,255,225,25,1,1,1
1025,PBP,parabrachial pigmented nucleus,parabrachial pigmented nucleus,PBP,DHBA:12263,#56A1BB,1360,240,50,230,1,1,1
1026,PIF,parainterfascicular nucleus,parainterfascicular nucleus,PIF,DHBA:12264,#56A1BB,1361,240,50,230,1,1,1
1027,PaN,paranigral nucleus,paranigral nucleus,PaN,DHBA:12265,#5298AE,1362,145,30,180,1,1,1
1028,IP,interpeduncular nucleus,interpeduncular nucleus,IP,DHBA:12270,#8EBDCD,362,70,94,82,1,1,1
1029,IPap,"interpeduncular nucleus, apical sudivision","interpeduncular nucleus, apical subnucleus",IPa,DHBA:12271,#6CA9BF,1363,210,245,60,1,1,1
1030,IPc,"interpeduncular nucleus, caudal subdivision","interpeduncular nucleus, caudal subnucleus",IPc,DHBA:12272,#6CA9BF,1364,0,130,200,1,1,1
1031,IPdm,"interpeduncular nucleus, dorsomedial subdivision","interpeduncular nucleus, dorsomedial subnucleus",IPdm,DHBA:12273,#6CA9BF,1365,245,130,48,1,1,1
1032,IPi,"interpeduncular nucleus, intermediate subdivision","interpeduncular nucleus, intermediate subnucleus",IPi,DHBA:12274,#6CA9BF,1366,0,130,200,1,1,1
1033,IPl,"interpeduncular nucleus, lateral subdivision","interpeduncular nucleus, lateral subnucleus",IPl,DHBA:12275,#6CA9BF,1367,255,225,25,1,1,1
1034,IPr,"interpeduncular nucleus, rostral subdivision","interpeduncular nucleus, apical subnucleus",IPa,DHBA:12271,#6CA9BF,1368,128,0,0,1,1,1
1035,MLC,lateral cell groups in midbrain,,,DHBA:AA30370,,1369,250,190,212,1,1,1
1036,PaL,paralemniscal nucleus,paralemniscal nucleus,PLN,DHBA:12495,#517DBE,1370,128,128,128,1,1,1
1037,PaL,paralemniscal nucleus,paralemniscal nucleus,PLN,DHBA:12495,#517DBE,1370,128,128,128,1,1,1
1038,PBG,parabigeminal nucleus,parabigeminal nucleus,PBG,DHBA:12312,#5298AE,1371,128,0,0,1,1,1
1039,MiTg,microcellular tegmental nucleus,microcellular tegmental nucleus,MiTg,DHBA:12281,#6CA9BF,1372,145,30,180,1,1,1
1040,Sag,sagulum nucleus (nucleus sagulum),sagulum nucleus,Sag,DHBA:12313,#56A1BB,1373,255,225,25,1,1,1
1041,SbB,subbrachial nucleus,subbrachial nucleus,SubB,DHBA:12290,#5298AE,1374,255,225,25,1,1,1
1042,LTN,lateral terminal nucleus of accessory nucleus of optic tract ,"accessory nuclei of optic tract, lateral nucleus",AOPl,DHBA:12192,#6CA9BF,1375,128,0,0,1,1,1
1043,MRF,midbrain reticular formation,midbrain reticular formation,MRF,DHBA:12239,#56A1BB,358,152,206,71,1,1,1
1044,CnF,cuneiform nucleus,cuneiform nucleus,CnF,DHBA:12240,#56A1BB,1376,128,128,128,1,1,1
1045,CnFd,dorsal part of cuneiform nucleus,,,DHBA:AA30371,,1377,220,190,255,1,1,1
1046,CnFv,ventral aprt of cuneiform nucleus,,,DHBA:AA30372,,1378,255,225,25,1,1,1
1047,PrCnF,precuneiform area,precuneiform area,PrCnF,DHBA:12241,#56A1BB,1379,128,128,128,1,1,1
1048,U-mb,nucleus U of midbrain,nucleus U,U,DHBA:12242,#56A1BB,1380,170,110,40,1,1,1
1049,PTg,pedunculo(pontine) tegmental  nucleus,pedunculo(pontine) tegmental  nucleus,PTg,DHBA:12243,#5298AE,1381,255,215,180,1,1,1
1050,PTgC,"pedunculo(pontine) tegmental  nucleus, compact part","pedunculo(pontine) tegmental  nucleus, compact part",PTgC,DHBA:12244,#5298AE,1382,245,130,48,1,1,1
1051,PTgD,"pedunculo(pontine) tegmental  nucleus, dissipated part","pedunculo(pontine) tegmental  nucleus, dissipated part",PTgD,DHBA:12245,#5298AE,1383,0,0,128,1,1,1
1052,SCnF,subcuneiform nucleus,subcuneiform nucleus,SubCn,DHBA:12246,#56A1BB,1384,230,25,75,1,1,1
1053,PaC,paracollicular tegmentum,paracollicular tegmentum,PaC,DHBA:12282,#6CA9BF,1385,128,0,0,1,1,1
1054,INPC,interstitial nucleus of posterior commissure (PCom),interstitial nucleus of posterior commissure,INPC,DHBA:12194,#56A1BB,1386,0,128,128,1,1,1
1055,MCPC,magocellular nucleus of posterior commissure,magnocellular nucleus of the posterior commissure,MCPC,DHBA:12279,#56A1BB,1387,128,128,128,1,1,1
1056,InC,interstitial nucleus of Cajal,interstitial nucleus of Cajal,InC,DHBA:12278,#5298AE,1388,128,0,0,1,1,1
1057,InCco,core of interstitial nucleus of Cajal,,,DHBA:AA30373,,1389,0,128,128,1,1,1
1058,InCsh,shell of interstitial nucleus of Cajal,,,DHBA:AA30374,,1390,255,225,25,1,1,1
1059,Pa4,paratrochlear nucleus,paratrochlear nucleus,Pa4,DHBA:12284,#56A1BB,1391,255,250,200,1,1,1
1060,MTgX,uncharted region in midbrain tegmentum,,,DHBA:AA30375,,1392,70,240,240,1,1,1
1061,MBDe,developing transient structures of midbrain,,,DHBA:AA30376,,1393,145,30,180,1,1,1
1062,MZM,marginal zone of midbrain,marginal zone of midbrain,MZM,DHBA:12326,#CDBABA,1394,170,255,195,1,1,1
1063,IZM,intermediate (mantal) zone of midbrain,intermediate (mantle) zone of midbrain,IZM,DHBA:12319,#9C8383,1395,170,110,40,1,1,1
1064,IZMro,roof plate of midbrain,roof plate of midbrain,IZMro,DHBA:12320,#937B7C,1396,128,128,0,1,1,1
1065,IZMal,alar plate (tectal zone) of midbrain,alar plate (tectal zone) of midbrain,IZMal,DHBA:12321,#937B7C,1397,255,250,200,1,1,1
1066,IZMba,basal plate of midbrain,basal plate of midbrain,IZMba,DHBA:12322,#937B7C,1398,0,128,128,1,1,1
1067,IZMfl,floor plate of midbrain,floor plate of midbrain,IZMfl,DHBA:12325,#9C8383,1399,145,30,180,1,1,1
1068,VZM,ventricular (matrix) zone of midbrain,ventricular (matrix) zone of midbrain,VZM,DHBA:12318,#81696B,1400,210,245,60,1,1,1
1069,HB,hindbrain (rhombencephalon),hindbrain (rhombencephalon),H,DHBA:10653,#CAD7EE,383,230,25,75,1,1,1
1070,HBSe,segmentation of hindbrain,,,DHBA:AA30377,,1401,60,180,75,1,1,1
1071,Met,metencephalon,metencephalon,Met,DHBA:10655,#B3C8E7,385,171,69,68,1,1,1
1072,CB,cerebellum,cerebellum,CB,DHBA:10656,#9EBAE1,386,183,77,46,1,1,1
1073,CBC,cerebellar cortex,cerebellar cortex,CBC,DHBA:10657,#89ADDB,387,206,181,251,1,1,1
1074,CBD,divisions (lobes) of cerebellar cortex,,,DHBA:AA30378,,1402,255,225,25,1,1,1
1075,ACb,anterior lobe of cerebellar cortex,anterior lobe,ACb,DHBA:12838,#4A8ECC,1403,220,190,255,1,1,1
1076,ACV,"anterior lobe, vermis part",,,DHBA:AA30379,,1404,255,225,25,1,1,1
1077,CV1,lobule I (lingula),,,DHBA:AA30380,,1405,0,130,200,1,1,1
1078,CV2-3,lobule II-III (central lobule),,,DHBA:AA30381,,1406,255,250,200,1,1,1
1079,CV2,"lobule II (central lobule, rostral part)",,,DHBA:AA30382,,1407,128,128,128,1,1,1
1080,CV3,"lobule III (central lobule, caudal part)",,,DHBA:AA30383,,1408,250,190,212,1,1,1
1081,CV4-5,Lobule IV-V (culmen),,,DHBA:AA30384,,1409,245,130,48,1,1,1
1082,CV4,"lobule IV (culmen, rostral part)",,,DHBA:AA30385,,1410,220,190,255,1,1,1
1083,CV5,"lobule V (culmen, caudal part)",,,DHBA:AA30386,,1411,245,130,48,1,1,1
1084,ACH,"anterior lobe, hemisphere part",,,DHBA:AA30387,,1412,145,30,180,1,1,1
1085,CH2-3,lobule II-III (wing of central lobule),,,DHBA:AA30388,,1413,255,250,200,1,1,1
1086,CH2,"lobule II (wing of central lobule, rostral part)",,,DHBA:AA30389,,1414,170,255,195,1,1,1
1087,CH3,"lobule III (wing of central lobule, caudal part)",,,DHBA:AA30390,,1415,250,190,212,1,1,1
1088,CH4-5,Lobule IV-V (quadrangular lobule),,,DHBA:AA30391,,1416,255,225,25,1,1,1
1089,CH4,"lobule IV (quadrangular lobule, rostral part)",,,DHBA:AA30392,,1417,0,130,200,1,1,1
1090,CH5,"lobule V (quadrangular lobule, caudal part)",,,DHBA:AA30393,,1418,255,250,200,1,1,1
1091,PCb,posterior lobe of cerebellar cortex,posterior lobe,PCb,DHBA:12844,#3E80BA,1419,0,130,200,1,1,1
1092,PCV,"posterior lobe, vermis part",,,DHBA:AA30394,,1420,210,245,60,1,1,1
1093,CV6,lobule VI (declive),,,DHBA:AA30395,,1421,255,225,25,1,1,1
1094,CV6a,"lobule VIA (declive, rostral part)",,,DHBA:AA30396,,1422,210,245,60,1,1,1
1095,CV6b,"Lobule VIB (declive, caudal part)",,,DHBA:AA30397,,1423,70,240,240,1,1,1
1096,CV7,lobule VII (folium and tuber),,,DHBA:AA30398,,1424,250,190,212,1,1,1
1097,CV7a,lobule VIIA-folium and tuber,,,DHBA:AA30399,,1425,0,130,200,1,1,1
1098,CV7a1,lobule VIIAf (folium),,,DHBA:AA30400,,1426,170,110,40,1,1,1
1099,CV7a2,"lobule VIIAt (tuber, part 1)",,,DHBA:AA30401,,1427,145,30,180,1,1,1
1100,CV7b,"lobule VIIB (tuber, part 2)",,,DHBA:AA30402,,1428,245,130,48,1,1,1
1101,CV8,Lobule VIII (pyramis),,,DHBA:AA30403,,1429,230,25,75,1,1,1
1102,CV8a,"lobule VIIIA (pyramis, part 1)",,,DHBA:AA30404,,1430,255,225,25,1,1,1
1103,CV8b,"lobule VIIIB (pyramis, part 2)",,,DHBA:AA30405,,1431,255,215,180,1,1,1
1104,CV9,lobule IX (uvula),,,DHBA:AA30406,,1432,0,128,128,1,1,1
1105,PCH,"posterior lobe, hemisphere part",,,DHBA:AA30407,,1433,145,30,180,1,1,1
1106,CH6,lobule VI (simple lobule),,,DHBA:AA30408,,1434,210,245,60,1,1,1
1107,CH6a,"lobule VIA (simple lobule, rostral part)",,,DHBA:AA30409,,1435,220,190,255,1,1,1
1108,CH6b,"Lobule VIB (simple lobule, caudal part)",,,DHBA:AA30410,,1436,255,215,180,1,1,1
1109,CH7,lobule VII (semilunar-gracile lobule),,,DHBA:AA30411,,1437,0,130,200,1,1,1
1110,CH7a,lobule VIIA (semilunar lobule/ansiform lobule),,,DHBA:AA30412,,1438,250,190,212,1,1,1
1111,CH7a1,lobule VIIA/crus I (superior semilunar lobule),,,DHBA:AA30413,,1439,170,255,195,1,1,1
1112,CH7a2,lobule VIIA/crus II (inferior semilunar lobule),,,DHBA:AA30414,,1440,230,25,75,1,1,1
1113,CH7b,lobule VIIB (gracile lobule),,,DHBA:AA30415,,1441,128,0,0,1,1,1
1114,CH8,Lobule VIII (biventral lobule),,,DHBA:AA30416,,1442,145,30,180,1,1,1
1115,CH8a,"lobule VIIIA (biventral lobule, part 1, paramedian lobule)",,,DHBA:AA30417,,1443,0,128,128,1,1,1
1116,CH8b,"lobule VIIIB (biventral lobule, part 2, copula pyramis)",,,DHBA:AA30418,,1444,0,128,128,1,1,1
1117,CH9,lobule IX (tonsil-paraflocculus),,,DHBA:AA30419,,1445,255,225,25,1,1,1
1118,CH9a,lobule IX (tonsil),,,DHBA:AA30420,,1446,250,190,212,1,1,1
1119,CH9b,lobule IX (paraflocculus),,,DHBA:AA30421,,1447,255,215,180,1,1,1
1120,FNCb,flocculonodular lobe of cerebellar cortex,flocculonodular lobe,FNCb,DHBA:12852,#3272AE,1448,255,225,25,1,1,1
1121,CV10,"flocculonodular lobe, vermis part (lobule X-nodulus)",,,DHBA:AA30422,,1449,0,128,128,1,1,1
1122,CH10,"flocculonodular lobe, flocculus part",,,DHBA:AA30423,,1450,60,180,75,1,1,1
1123,CH10a,lobule X (flocculus),,,DHBA:AA30424,,1451,220,190,255,1,1,1
1124,CH10b,Lobule X (accessory paraflocculus),,,DHBA:AA30425,,1452,60,180,75,1,1,1
1125,CbL,layers of cerebellar cortex,,,DHBA:AA30426,,1453,255,225,25,1,1,1
1126,CbL1,molecular layer of cerebellar cortex,,,DHBA:AA30427,,1454,70,240,240,1,1,1
1127,CbL2,Purkinje cell layer of cerebellar cortex,,,DHBA:AA30428,,1455,210,245,60,1,1,1
1128,CbL3,granular cell layer of cerebellar cortex,,,DHBA:AA30429,,1456,240,50,230,1,1,1
1129,CbDN,cerebellar deep nuclei,cerebellar deep nuclei,CbDN,DHBA:10660,#3E80BA,395,205,152,30,1,1,1
1130,DT,dentate (lateral) nucleus,dentate (lateral) nucleus,DT,DHBA:12396,#19457E,396,208,76,181,1,1,1
1131,DTlv,"dentate nucleus, lateroventral part","dentate nucleus, lateroventral part",DTlv,DHBA:12397,#19457E,1457,255,225,25,1,1,1
1132,DTmd,"dentate nucleus, mediodorsal part","dentate nucleus, mediodorsal part",DTmd,DHBA:12398,#19457E,1458,230,25,75,1,1,1
1133,InP,interpositus (intermediate) nucleus,interpositus (intermediate) nucleus,InP,DHBA:12399,#115A95,397,187,61,118,1,1,1
1134,InPm,medial interpositus (globose) nucleus,medial interpositus (globose) nucleus,InPM,DHBA:12400,#115A95,1459,245,130,48,1,1,1
1135,InPl,lateral interpositus (emboliform) nucleus,lateral interpositus (emboliform) nucleus,InPL,DHBA:12401,#115A95,1460,255,250,200,1,1,1
1136,FAS,fastigial (medial) nucleus,fastigial (medial) nucleus,Fas,DHBA:12402,#3272AE,398,60,180,75,1,1,1
1137,FASm,"fastigial nucleus, medial part","fastigial nucleus, medial part",FasM,DHBA:12404,#3272AE,1461,210,245,60,1,1,1
1138,FASl,"fastigial nucleus, lateral part","fastigial nucleus, lateral part",FasL,DHBA:12403,#3272AE,1462,0,130,200,1,1,1
1139,BIcb,basal interstitial nucleus of cerebellum,basal interstitial nucleus of cerebellum,BIcb,DHBA:267499207,#19457E,1463,240,50,230,1,1,1
1140,Pn,pons,pons,Pn,DHBA:10661,#AFC3DB,399,29,0,139,1,1,1
1141,LBSSe,segmentation of pons,,,DHBA:AA30430,,1464,230,25,75,1,1,1
1142,PnBa,basilar part of pons,basilar part of pons,PnBa,DHBA:12405,#7893C7,400,227,145,164,1,1,1
1143,PN,pontine nucleus,pontine nucleus,PN,DHBA:12406,#6586BF,401,210,192,155,1,1,1
1144,PNd,dorsal part of pontine nucleus,dorsal nucleus,PNd,DHBA:12407,#4E78B0,1465,128,0,0,1,1,1
1145,PNdl,dorsolateral part of pontine nucleus,dorsolateral nucleus,PNdl,DHBA:12408,#4E78B0,1466,0,0,128,1,1,1
1146,PNdm,dorsomedial part of pontine nucleus,dorsomedial nucleus,PNdm,DHBA:12409,#4E78B0,1467,128,128,128,1,1,1
1147,PNl,lateral part of pontine nucleus,lateral nucleus,PNl,DHBA:12410,#4E78B0,1468,128,0,0,1,1,1
1148,PNm,median part of pontine nucleus,median nucleus,PNm,DHBA:12411,#4E78B0,1469,220,190,255,1,1,1
1149,PNpa,paramedian part of pontine nucleus,paramedian nucleus,PNpar,DHBA:12412,#4E78B0,1470,0,0,128,1,1,1
1150,PNpd,peduncular part of pontine nucleus,peduncular nucleus,PNped,DHBA:12413,#4E78B0,1471,0,128,128,1,1,1
1151,PnTg,pontine tegmentum,pontine tegmentum,PnTg,DHBA:12416,#6586BF,402,77,55,166,1,1,1
1152,PnCG,central gray region of pons,central gray of pons,PnCG,DHBA:146034964,#517DBE,1472,245,130,48,1,1,1
1153,DTg,dorsal tegmental nucleus,dorsal tegmental nucleus,DTg,DHBA:12508,#517DBE,1473,210,245,60,1,1,1
1154,DTgC,"dorsal tegmental nucleus, central part","dorsal tegmental nucleus, central part",DTgC,DHBA:12509,#4E78B0,1474,70,240,240,1,1,1
1155,DTgP,"dorsal tegmental nucleus, pericentral part","dorsal tegmental nucleus, pericentral part",DTgP,DHBA:12510,#4E78B0,1475,230,25,75,1,1,1
1156,PDTg,posterodorsal tegmental nucleus,posterodorsal tegmental nucleus,PDTg,DHBA:12286,#5298AE,1476,255,250,200,1,1,1
1157,LDTg,laterodorsal tegmental nucleus,laterodorsal tegmental nucleus,LDTg,DHBA:12519,#4E78B0,1477,60,180,75,1,1,1
1158,LDTgD,dorsal part of laterodorsal tegmental nucleus,"laterodorsal tegmental nucleus, dorsal part",LDTgD,DHBA:12520,#4E78B0,1478,0,0,128,1,1,1
1159,LDTgV,ventral part of laterodorsal tegmental nucleus,"laterodorsal tegmental nucleus, ventral part",LDTgV,DHBA:12521,#4E78B0,1479,128,128,0,1,1,1
1160,DMTg,dorsomedial tegmental area,dorsomedial tegmental area,DMTg,DHBA:15557,#517DBE,1480,210,245,60,1,1,1
1161,DMTg,dorsomedial tegmental nucleus,dorsomedial tegmental area,DMTg,DHBA:15557,#517DBE,1480,210,245,60,1,1,1
1162,Bar,Barrington's nucleus,Barrington's nucleus,Bar,DHBA:12506,#517DBE,1481,255,250,200,1,1,1
1163,SPN,sphenoid nucleus,,,DHBA:AA30431,,1482,250,190,212,1,1,1
1164,NI,nucleus incertus,nucleus incertus,NI,DHBA:146034972,#6586BF,1483,170,110,40,1,1,1
1165,NIM,medial part of nucleus incertus,,,DHBA:AA30432,,1484,170,255,195,1,1,1
1166,NIL,lateral part of nucleus incertus,,,DHBA:AA30433,,1485,0,0,128,1,1,1
1167,PnE,ependyma and subependymal layers of pons,ependyma and subependymal layers of pons,PnE,DHBA:146034968,#517DBE,1486,70,240,240,1,1,1
1168,PeG,periventricular gray of pons,central gray of pons,PnCG,DHBA:146034964,#517DBE,1487,170,255,195,1,1,1
1169,NC,nucleus coeruleus (locus coeruleus),nucleus coeruleus,NC,DHBA:12499,#3A5680,431,58,106,250,1,1,1
1170,EpC,epicoeruleus nucleus,epicoeruleus nucleus,EpC,DHBA:12512,#517DBE,1488,128,0,0,1,1,1
1171,Me5-pn,"mesencephalic nucleus of trigeminal nerve, pontine part","mesencephalic nucleus of trigeminal nerve, pontine part",Me5-p,DHBA:12443,#476A9A,412,255,250,200,1,1,1
1172,PnEN,efferent nuclei of cranial nerves in pons,efferent nuclei of cranial nerves in pons,PnEN,DHBA:12417,#4C72A8,403,72,47,47,1,1,1
1173,6N,abducens nucleus,abducens nucleus,6N,DHBA:12418,#476A9A,404,89,140,56,1,1,1
1174,SGe,supragenual nucleus,supragenual nucleus,SGe,DHBA:12662,#727CB6,1489,128,128,0,1,1,1
1175,7N,facial nucleus,facial nucleus,7N,DHBA:12420,#476A9A,406,75,248,204,1,1,1
1176,7D,"facial nucleus, dorsal subnucleus","facial nucleus, dorsal subnucleus",7D,DHBA:12421,#406290,1490,220,190,255,1,1,1
1177,7DI,"facial nucleus, dorsointermediate subnucleus",,,DHBA:AA30434,,1491,145,30,180,1,1,1
1178,7DM,"facial nucleus, dorsomedial subnucleus",,,DHBA:AA30435,,1492,128,128,128,1,1,1
1179,7I,"facial nucleus, intermediate subnucleus",,,DHBA:AA30436,,1493,220,190,255,1,1,1
1180,7L,"facial nucleus, lateral subnucleus",,,DHBA:AA30437,,1494,70,240,240,1,1,1
1181,7VI,"facial nucleus, ventrointermediate subnucleus","facial nucleus, ventrointermediate subnucleus",7VI,DHBA:12422,#406290,1495,170,110,40,1,1,1
1182,7VM,"facial nucleus, ventromedial subnucleus","facial nucleus, ventromedial subnucleus",7VM,DHBA:12424,#406290,1496,0,128,128,1,1,1
1183,7SH,"facial nucleus,stylohyoid part","facial nucleus,stylohyoid part",7SH,DHBA:15554,#406290,1497,255,215,180,1,1,1
1184,7VL,"facial nucleus, ventrolateral subnucleus","facial nucleus, ventrolateral subnucleus",7VL,DHBA:12427,#406290,1498,170,110,40,1,1,1
1185,PF7,perifacial zone,perifacial zone,PF7,DHBA:12425,#D1D7E8,1499,255,250,200,1,1,1
1186,Lac,lacrimal nucleus,lacrimal nucleus,Lac,DHBA:12428,#4C72A8,407,175,82,232,1,1,1
1187,SSV,superior salivatory nucleus,superior salivatory nucleus,SuSV,DHBA:12435,#476A9A,409,60,180,75,1,1,1
1188,PnLC,lateral cell groups of pons,lateral cell column of pons,LCCP,DHBA:12706,#8C7373,1500,210,245,60,1,1,1
1189,5N,"motor nucleus of trigeminal nerve (motor trigeminal nucleus, Mo5)",motor nucleus of trigeminal nerve,Mo5,DHBA:12429,#476A9A,408,255,250,200,1,1,1
1190,5Npt,"motor nucleus of trigeminal nerve, pterygoid part","motor nucleus of trigeminal nerve, lateral pterygoid part",Mo5lpt,DHBA:12430,#406290,1501,255,215,180,1,1,1
1191,5Nma,"motor nucleus of trigeminal nerve, masseter part","motor nucleus of trigeminal nerve, masseter part",Mo5ma,DHBA:12431,#406290,1502,128,128,0,1,1,1
1192,5Npc,"motor nucleus of trigeminal nerve, parvicellular part","motor nucleus of trigeminal nerve, medial pterygoid part",Mo5mpt,DHBA:12432,#406290,1503,240,50,230,1,1,1
1193,5Nmy,"motor nucleus of trigeminal nerve, mylohyoid part","motor nucleus of trigeminal nerve, mylohyoid part",Mo5my,DHBA:12433,#406290,1504,255,225,25,1,1,1
1194,5Nte,"motor nucleus of trigeminal nerve, temporalis part","motor nucleus of trigeminal nerve, temporalis part",Mo5te,DHBA:12434,#406290,1505,128,128,128,1,1,1
1195,5Nrd,"motor nucleus of trigeminal nerve, rostral digastric part",,,DHBA:AA30438,,1506,255,215,180,1,1,1
1196,PnAN,afferent nuclei of cranial nerves in pons,afferent nuclei of cranial nerves in pons,PnAN,DHBA:12436,#517DBE,410,126,129,233,1,1,1
1197,8Co,cochlear nuclei,cochlear nuclei,8Co,DHBA:12437,#4C72A8,411,51,235,47,1,1,1
1198,DCo,dorsal cochlear nucleus,dorsal cochlear nucleus,DCo,DHBA:12438,#476A9A,1507,250,190,212,1,1,1
1199,GrCo,granular cell layer of cochlear nuclei,granular cell layer of cochlear nuclei,GrCo,DHBA:12442,#406290,1508,70,240,240,1,1,1
1200,VCo,ventral cochlear nucleus,ventral cochlear nucleus,VCo,DHBA:12439,#476A9A,1509,70,240,240,1,1,1
1201,VCoR,"ventral cochlear nucleus, rostral part","ventral cochlear nucleus, rostral part",VCoR,DHBA:12440,#476A9A,1510,210,245,60,1,1,1
1202,VCoC,"ventral cochlear nucleus, caudal part","ventral cochlear nucleus, caudal part",VCoC,DHBA:12441,#476A9A,1511,145,30,180,1,1,1
1203,Pr5,principal sensory nucleus of trigeminal nerve,principal sensory nucleus of trigeminal nerve,Pr5,DHBA:12444,#406290,413,153,215,10,1,1,1
1204,Pr5dm,dorsomedial nucleus of Pr5,dorsomedial nucleus of Pr5,Pr5dm,DHBA:12445,#406290,1512,0,128,128,1,1,1
1205,Pr5vl,ventrolateral nucleus of Pr5,ventrolateral nucleus of Pr5,Pr5vl,DHBA:12446,#406290,1513,170,255,195,1,1,1
1206,Sp5r,"spinal nucleus of trigeminal nerve, rostral subnucleus","spinal nucleus of trigeminal nerve, oral subnucleus",Sp5o,DHBA:12447,#406290,414,245,130,48,1,1,1
1207,8VNpn,vestibular nuclei in pons,vestibular nuclei in pons,8Ve-p,DHBA:12448,#4C72A8,415,255,225,25,1,1,1
1208,LaVN,lateral vestibular nucleus,lateral vestibular nucleus,LVe,DHBA:12449,#476A9A,1514,240,50,230,1,1,1
1209,LVNmc,"lateral vestibular nucleus, magnocellular part","lateral vestibular nucleus, magnocellular part",LVeMC,DHBA:12450,#476A9A,1515,220,190,255,1,1,1
1210,LVNpc,"lateral vestibular nucleus, parvicellular part","lateral vestibular nucleus, parvicellular part",LVePC,DHBA:12451,#476A9A,1516,220,190,255,1,1,1
1211,SuVN,superior vestibular nucleus,superior vestibular nucleus,SuVe,DHBA:12452,#4C72A8,1517,170,110,40,1,1,1
1212,NLL,nuclei of lateral lemniscus,nuclei of lateral lemniscus,LLN,DHBA:12454,#4E78B0,418,128,0,0,1,1,1
1213,DLL,dorsal nucleus of lateral lemniscus,dorsal nucleus of lateral lemniscus,DLL,DHBA:12455,#4C72A8,1518,220,190,255,1,1,1
1214,ILL,intermediate nucleus of lateral lemniscus,intermediate nucleus of lateral lemniscus,ILL,DHBA:12456,#4C72A8,1519,220,190,255,1,1,1
1215,VLL,ventral nucleus of lateral lemniscus,ventral nucleus of lateral lemniscus,VLL,DHBA:12457,#4C72A8,1520,245,130,48,1,1,1
1216,PaL,paralemniscal nucleus,paralemniscal nucleus,PLN,DHBA:12495,#517DBE,1370,128,128,128,1,1,1
1217,PaL,paralemniscal nucleus,paralemniscal nucleus,PLN,DHBA:12495,#517DBE,1370,128,128,128,1,1,1
1218,PB,parabrachial nuclei,parabrachial nuclei,PB,DHBA:12481,#517DBE,424,152,18,66,1,1,1
1219,LPB,lateral parabrachial nucleus,lateral parabrachial nucleus,LPB,DHBA:12482,#4E78B0,425,246,186,215,1,1,1
1220,LPBce,"lateral parabrachial nucleus, central part","lateral parabrachial nucleus, central part",LPBc,DHBA:12483,#4E78B0,1522,245,130,48,1,1,1
1221,LPBd,"lateral parabrachial nucleus, dorsal part","lateral parabrachial nucleus, dorsal part",LPBd,DHBA:12484,#4E78B0,1523,170,110,40,1,1,1
1222,LPBe,"lateral parabrachial nucleus, external part","lateral parabrachial nucleus, external part",LPBe,DHBA:12485,#4E78B0,1524,0,128,128,1,1,1
1223,LPBs,"lateral parabrachial nucleus, superior part","lateral parabrachial nucleus, superior part",LPBs,DHBA:12486,#4E78B0,1525,145,30,180,1,1,1
1224,MPB,medial parabrachial nucleus,medial parabrachial nucleus,MPB,DHBA:12487,#517DBE,426,70,215,186,1,1,1
1225,MPBe,"medial parabrachial nucleus, external part","medial parabrachial nucleus, external part",MPBe,DHBA:12488,#4E78B0,1526,245,130,48,1,1,1
1226,MPBm,"medial parabrachial nucleus, medial part","medial parabrachial nucleus, medial part",MPBm,DHBA:12489,#4E78B0,1527,145,30,180,1,1,1
1227,PnLCx,other nuclei in lateral cell groups of pons,,,DHBA:AA30439,,1528,250,190,212,1,1,1
1228,PnG,pontine gamma nucleus,pontine gamma nucleus,PnG,DHBA:12513,#3D5C87,1529,0,0,128,1,1,1
1229,KF,Koelliker-Fuse nucleus,Koelliker-Fuse nucleus,KF,DHBA:12518,#4E78B0,1530,170,255,195,1,1,1
1230,I5,intertrigeminal nucleus,intertrigeminal nucleus,I5,DHBA:12516,#517DBE,1531,220,190,255,1,1,1
1231,P5,peritrigeminal zone,peritrigeminal zone,P5,DHBA:12529,#517DBE,1532,0,0,128,1,1,1
1232,Su5,supratrigeminal nucleus,,,DHBA:AA30440,,1533,245,130,48,1,1,1
1233,NA7,A7 noradrenaline cell group,caudal division of SPC (area 7),A7,DHBA:10220,#E49C33,1534,230,25,75,1,1,1
1234,Pa6,paraabducens nucleus,paraabducens nucleus,Pa6,DHBA:12524,#517DBE,1535,250,190,212,1,1,1
1235,PnVe,ventral cell groups in pontine tegmentum,,,DHBA:AA30441,,1536,230,25,75,1,1,1
1236,TrZ,nucleus of trapezoid body,nucleus of trapezoid body,TrZ,DHBA:12458,#4E78B0,419,93,4,18,1,1,1
1237,TrZl,lateral nucleus of trapezoid body,lateral nucleus of trapezoid body,TrZl,DHBA:12459,#4C72A8,1537,0,130,200,1,1,1
1238,TrZm,medial nucleus of trapezoid body,medial nucleus of trapezoid body,TrZm,DHBA:12460,#4C72A8,1538,0,130,200,1,1,1
